{
  "$schema": "https://json-schema.org/draft/2020-12/schema",
  "$id": "pilot.runlog.schema.v1",
  "type": "object",
  "required": [
    "run_id",
    "goal",
    "plan",
    "events",
    "artifacts",
    "final_result"
  ],
  "properties": {
    "run_id": {
      "type": "string",
      "format": "uuid"
    },
    "goal": {
      "type": "string",
      "minLength": 1
    },
    "plan": {
      "type": "array",
      "minItems": 1,
      "items": {
        "$ref": "#/$defs/action"
      }
    },
    "events": {
      "type": "array",
      "items": {
        "type": "object",
        "required": [
          "ts",
          "action_id",
          "status"
        ],
        "properties": {
          "ts": {
            "type": "string",
            "format": "date-time"
          },
          "action_id": {
            "type": "string",
            "format": "uuid"
          },
          "status": {
            "type": "string",
            "enum": [
              "planned",
              "awaiting_approval",
              "in_progress",
              "ok",
              "fail",
              "retrying",
              "skipped",
              "rolled_back"
            ]
          },
          "attempt": {
            "type": "integer",
            "minimum": 1
          },
          "stdout": {
            "type": "string"
          },
          "stderr": {
            "type": "string"
          },
          "error_code": {
            "type": [
              "string",
              "null"
            ]
          },
          "redacted": {
            "type": "boolean",
            "default": false
          }
        },
        "additionalProperties": false
      }
    },
    "artifacts": {
      "type": "array",
      "items": {
        "type": "object",
        "required": [
          "path",
          "description"
        ],
        "properties": {
          "path": {
            "type": "string"
          },
          "description": {
            "type": "string"
          },
          "sha256": {
            "type": [
              "string",
              "null"
            ]
          }
        },
        "additionalProperties": false
      }
    },
    "repair_history": {
      "type": "array",
      "items": {
        "type": "object",
        "required": [
          "ts",
          "action_id",
          "failure_signature",
          "patch",
          "outcome"
        ],
        "properties": {
          "ts": {
            "type": "string",
            "format": "date-time"
          },
          "action_id": {
            "type": "string",
            "format": "uuid"
          },
          "failure_signature": {
            "type": "string"
          },
          "patch": {
            "type": "string"
          },
          "outcome": {
            "type": "string",
            "enum": [
              "resolved",
              "unresolved"
            ]
          }
        },
        "additionalProperties": false
      }
    },
    "final_result": {
      "type": "object",
      "required": [
        "status",
        "summary"
      ],
      "properties": {
        "status": {
          "type": "string",
          "enum": [
            "ok",
            "partial",
            "failed"
          ]
        },
        "summary": {
          "type": "string"
        }
      },
      "additionalProperties": false
    }
  },
  "$defs": {
    "action": {
      "type": "object",
      "required": [
        "action_id",
        "type",
        "args",
        "risk",
        "requires_approval",
        "expected_output",
        "rollback"
      ],
      "properties": {
        "action_id": {
          "type": "string",
          "format": "uuid"
        },
        "type": {
          "type": "string",
          "enum": [
            "fs.list",
            "fs.search",
            "fs.move",
            "fs.rename",
            "process.start",
            "process.stop",
            "window.focus",
            "window.screenshot",
            "browser.open",
            "browser.click",
            "browser.type",
            "browser.download",
            "shell.run",
            "extract.text",
            "extract.table"
          ]
        },
        "args": {
          "type": "object"
        },
        "risk": {
          "type": "string",
          "enum": [
            "low",
            "medium",
            "high"
          ]
        },
        "requires_approval": {
          "type": "boolean"
        },
        "expected_output": {
          "type": "string"
        },
        "rollback": {
          "type": [
            "object",
            "null"
          ],
          "required": [
            "type",
            "args"
          ],
          "properties": {
            "type": {
              "type": "string"
            },
            "args": {
              "type": "object"
            }
          },
          "additionalProperties": false
        },
        "timeout_ms": {
          "type": "integer",
          "minimum": 100,
          "maximum": 600000,
          "default": 120000
        },
        "retries": {
          "type": "integer",
          "minimum": 0,
          "maximum": 3,
          "default": 1
        },
        "on_failure": {
          "type": "string",
          "enum": [
            "halt",
            "skip",
            "retry_alternate"
          ],
          "default": "halt"
        }
      },
      "additionalProperties": false
    }
  },
  "additionalProperties": false
}

