{
  "run_id": "77057024-d31a-42a9-8922-72584455702f",
  "goal": "list .tmp",
  "plan": [
    {
      "action_id": "39fa45df-e4f2-4ea4-ab63-c3d70cb3834f",
      "type": "fs.list",
      "args": {
        "path": "D:\\Jarvis-proto3\\.tmp",
        "recursive": false
      },
      "risk": "low",
      "requires_approval": false,
      "expected_output": "List files in target path.",
      "rollback": null,
      "timeout_ms": 120000,
      "retries": 1,
      "on_failure": "halt"
    }
  ],
  "events": [
    {
      "ts": "2026-03-03T23:56:32.008Z",
      "action_id": "39fa45df-e4f2-4ea4-ab63-c3d70cb3834f",
      "status": "planned"
    },
    {
      "ts": "2026-03-03T23:56:32.008Z",
      "action_id": "39fa45df-e4f2-4ea4-ab63-c3d70cb3834f",
      "status": "skipped",
      "stdout": "Dry run mode: action not executed."
    }
  ],
  "artifacts": [],
  "repair_history": [],
  "final_result": {
    "status": "ok",
    "summary": "Run completed successfully."
  }
}