{
  "run_id": "b5671bb3-5be2-4432-82a7-6cc04cf2baea",
  "goal": "list .tmp",
  "plan": [
    {
      "action_id": "e52003d7-f7bb-47e9-a8cd-5c77735892e0",
      "type": "fs.list",
      "args": {
        "path": "D:\\Jarvis-proto3\\.tmp",
        "recursive": false
      },
      "risk": "low",
      "requires_approval": false,
      "expected_output": "List files in target path.",
      "rollback": null,
      "timeout_ms": 120000,
      "retries": 1,
      "on_failure": "halt"
    }
  ],
  "events": [
    {
      "ts": "2026-03-04T03:21:22.440Z",
      "action_id": "e52003d7-f7bb-47e9-a8cd-5c77735892e0",
      "status": "planned"
    },
    {
      "ts": "2026-03-04T03:21:22.440Z",
      "action_id": "e52003d7-f7bb-47e9-a8cd-5c77735892e0",
      "status": "skipped",
      "stdout": "Dry run mode: action not executed."
    }
  ],
  "artifacts": [],
  "repair_history": [],
  "final_result": {
    "status": "ok",
    "summary": "Run completed successfully."
  }
}