{
  "run_id": "d425d75c-38f8-48d9-b620-df7b228e499b",
  "goal": "list .tmp then shell Get-Date -Format o",
  "plan": [
    {
      "action_id": "bbd2caeb-edcb-4c89-a0c7-e70adff6165b",
      "type": "fs.list",
      "args": {
        "path": "D:\\Jarvis-proto3\\.tmp",
        "recursive": false
      },
      "risk": "low",
      "requires_approval": false,
      "expected_output": "List files in target path.",
      "rollback": null,
      "timeout_ms": 120000,
      "retries": 1,
      "on_failure": "halt"
    },
    {
      "action_id": "c6c84f45-620d-4c58-bfd9-f8b96918f559",
      "type": "shell.run",
      "args": {
        "command": "Get-Date",
        "args": [
          "-Format",
          "o"
        ]
      },
      "risk": "medium",
      "requires_approval": false,
      "expected_output": "Execute allowlisted PowerShell command.",
      "rollback": null,
      "timeout_ms": 120000,
      "retries": 1,
      "on_failure": "halt"
    }
  ],
  "events": [
    {
      "ts": "2026-03-04T00:30:02.187Z",
      "action_id": "bbd2caeb-edcb-4c89-a0c7-e70adff6165b",
      "status": "planned"
    },
    {
      "ts": "2026-03-04T00:30:02.187Z",
      "action_id": "bbd2caeb-edcb-4c89-a0c7-e70adff6165b",
      "status": "skipped",
      "stdout": "Dry run mode: action not executed."
    },
    {
      "ts": "2026-03-04T00:30:02.187Z",
      "action_id": "c6c84f45-620d-4c58-bfd9-f8b96918f559",
      "status": "planned"
    },
    {
      "ts": "2026-03-04T00:30:02.187Z",
      "action_id": "c6c84f45-620d-4c58-bfd9-f8b96918f559",
      "status": "skipped",
      "stdout": "Dry run mode: action not executed."
    }
  ],
  "artifacts": [],
  "repair_history": [],
  "final_result": {
    "status": "ok",
    "summary": "Run completed successfully."
  }
}