{
  "run_id": "40a0df11-b0a1-4df8-b9cf-501b5feebc21",
  "goal": "shell Get-Date -Format o",
  "plan": [
    {
      "action_id": "c3fe9b95-6df2-4711-be36-908c501172a4",
      "type": "shell.run",
      "args": {
        "command": "Get-Date",
        "args": [
          "-Format",
          "o"
        ]
      },
      "risk": "medium",
      "requires_approval": false,
      "expected_output": "Execute allowlisted PowerShell command.",
      "rollback": null,
      "timeout_ms": 120000,
      "retries": 1,
      "on_failure": "halt"
    }
  ],
  "events": [
    {
      "ts": "2026-03-04T00:21:52.230Z",
      "action_id": "c3fe9b95-6df2-4711-be36-908c501172a4",
      "status": "planned"
    },
    {
      "ts": "2026-03-04T00:21:52.230Z",
      "action_id": "c3fe9b95-6df2-4711-be36-908c501172a4",
      "status": "skipped",
      "stdout": "Dry run mode: action not executed."
    }
  ],
  "artifacts": [],
  "repair_history": [],
  "final_result": {
    "status": "ok",
    "summary": "Run completed successfully."
  }
}