{
  "run_id": "8904b974-75f6-46f7-956a-ccd41a2f8e5a",
  "goal": "list .tmp then shell Get-Date -Format o",
  "plan": [
    {
      "action_id": "0ccb9033-e9b1-44f1-80a4-9b252d8a4021",
      "type": "fs.list",
      "args": {
        "path": "D:\\Jarvis-proto3\\.tmp",
        "recursive": false
      },
      "risk": "low",
      "requires_approval": false,
      "expected_output": "List files in target path.",
      "rollback": null,
      "timeout_ms": 120000,
      "retries": 1,
      "on_failure": "halt"
    },
    {
      "action_id": "87927b30-2c20-4d6c-b612-59aa9c64e868",
      "type": "shell.run",
      "args": {
        "command": "Get-Date",
        "args": [
          "-Format",
          "o"
        ]
      },
      "risk": "medium",
      "requires_approval": false,
      "expected_output": "Execute allowlisted PowerShell command.",
      "rollback": null,
      "timeout_ms": 120000,
      "retries": 1,
      "on_failure": "halt"
    }
  ],
  "events": [
    {
      "ts": "2026-03-04T00:22:41.773Z",
      "action_id": "0ccb9033-e9b1-44f1-80a4-9b252d8a4021",
      "status": "planned"
    },
    {
      "ts": "2026-03-04T00:22:41.773Z",
      "action_id": "0ccb9033-e9b1-44f1-80a4-9b252d8a4021",
      "status": "skipped",
      "stdout": "Dry run mode: action not executed."
    },
    {
      "ts": "2026-03-04T00:22:41.773Z",
      "action_id": "87927b30-2c20-4d6c-b612-59aa9c64e868",
      "status": "planned"
    },
    {
      "ts": "2026-03-04T00:22:41.773Z",
      "action_id": "87927b30-2c20-4d6c-b612-59aa9c64e868",
      "status": "skipped",
      "stdout": "Dry run mode: action not executed."
    }
  ],
  "artifacts": [],
  "repair_history": [],
  "final_result": {
    "status": "ok",
    "summary": "Run completed successfully."
  }
}