{
  "run_id": "009a5a81-0292-4068-8e13-70b81c3861d1",
  "goal": "test plan",
  "plan": [
    {
      "action_id": "271012cd-28d1-4188-8362-756dcf7e18f4",
      "type": "shell.run",
      "args": {
        "command": "Get-Date",
        "args": [
          "-Format",
          "o"
        ]
      },
      "risk": "high",
      "requires_approval": true,
      "expected_output": "date",
      "rollback": null,
      "retries": 0,
      "timeout_ms": 1000,
      "on_failure": "halt"
    }
  ],
  "events": [
    {
      "ts": "2026-03-03T23:50:08.601Z",
      "action_id": "271012cd-28d1-4188-8362-756dcf7e18f4",
      "status": "planned"
    },
    {
      "ts": "2026-03-03T23:50:08.601Z",
      "action_id": "271012cd-28d1-4188-8362-756dcf7e18f4",
      "status": "awaiting_approval",
      "stderr": "Action requires explicit approval and auto-approve is disabled."
    }
  ],
  "artifacts": [],
  "repair_history": [],
  "final_result": {
    "status": "partial",
    "summary": "Run halted pending approval or skip policy."
  }
}