{
  "run_id": "4549daae-4cb6-456d-af6b-67018cff3df0",
  "goal": "shell Get-Date -Format o",
  "plan": [
    {
      "action_id": "710fe813-699e-4572-affb-c60e7ad0b7b4",
      "type": "shell.run",
      "args": {
        "command": "Get-Date",
        "args": [
          "-Format",
          "o"
        ]
      },
      "risk": "medium",
      "requires_approval": false,
      "expected_output": "Execute allowlisted PowerShell command.",
      "rollback": null,
      "timeout_ms": 120000,
      "retries": 1,
      "on_failure": "halt"
    }
  ],
  "events": [
    {
      "ts": "2026-03-04T00:21:51.650Z",
      "action_id": "710fe813-699e-4572-affb-c60e7ad0b7b4",
      "status": "planned"
    },
    {
      "ts": "2026-03-04T00:21:51.650Z",
      "action_id": "710fe813-699e-4572-affb-c60e7ad0b7b4",
      "status": "skipped",
      "stdout": "Dry run mode: action not executed."
    }
  ],
  "artifacts": [],
  "repair_history": [],
  "final_result": {
    "status": "ok",
    "summary": "Run completed successfully."
  }
}