{
  "run_id": "9d07bdd4-d090-4244-8ac7-499f567a9b5a",
  "goal": "test plan",
  "plan": [
    {
      "action_id": "65ff38c3-c283-4f31-956e-34ce91d929ab",
      "type": "fs.list",
      "args": {
        "path": "D:\\Jarvis-proto3\\.tmp",
        "recursive": false
      },
      "risk": "low",
      "requires_approval": false,
      "expected_output": "List files.",
      "rollback": null,
      "retries": 0,
      "timeout_ms": 1000,
      "on_failure": "halt"
    }
  ],
  "events": [
    {
      "ts": "2026-03-04T03:24:44.207Z",
      "action_id": "65ff38c3-c283-4f31-956e-34ce91d929ab",
      "status": "planned"
    },
    {
      "ts": "2026-03-04T03:24:44.207Z",
      "action_id": "65ff38c3-c283-4f31-956e-34ce91d929ab",
      "status": "skipped",
      "stdout": "Dry run mode: action not executed."
    }
  ],
  "artifacts": [],
  "repair_history": [],
  "final_result": {
    "status": "ok",
    "summary": "Run completed successfully."
  }
}