{
  "run_id": "067ff5a8-e512-4719-a1e9-987f1230e5be",
  "goal": "list .tmp then shell Get-Date -Format o",
  "plan": [
    {
      "action_id": "b51af105-4c5f-43ea-990e-2417fef373f4",
      "type": "fs.list",
      "args": {
        "path": "D:\\Jarvis-proto3\\.tmp",
        "recursive": false
      },
      "risk": "low",
      "requires_approval": false,
      "expected_output": "List files in target path.",
      "rollback": null,
      "timeout_ms": 120000,
      "retries": 1,
      "on_failure": "halt"
    },
    {
      "action_id": "e89eaf81-124b-4ae8-8d16-1724021cc435",
      "type": "shell.run",
      "args": {
        "command": "Get-Date",
        "args": [
          "-Format",
          "o"
        ]
      },
      "risk": "medium",
      "requires_approval": false,
      "expected_output": "Execute allowlisted PowerShell command.",
      "rollback": null,
      "timeout_ms": 120000,
      "retries": 1,
      "on_failure": "halt"
    }
  ],
  "events": [
    {
      "ts": "2026-03-04T00:45:51.878Z",
      "action_id": "b51af105-4c5f-43ea-990e-2417fef373f4",
      "status": "planned"
    },
    {
      "ts": "2026-03-04T00:45:51.878Z",
      "action_id": "b51af105-4c5f-43ea-990e-2417fef373f4",
      "status": "skipped",
      "stdout": "Dry run mode: action not executed."
    },
    {
      "ts": "2026-03-04T00:45:51.878Z",
      "action_id": "e89eaf81-124b-4ae8-8d16-1724021cc435",
      "status": "planned"
    },
    {
      "ts": "2026-03-04T00:45:51.878Z",
      "action_id": "e89eaf81-124b-4ae8-8d16-1724021cc435",
      "status": "skipped",
      "stdout": "Dry run mode: action not executed."
    }
  ],
  "artifacts": [],
  "repair_history": [],
  "final_result": {
    "status": "ok",
    "summary": "Run completed successfully."
  }
}