{
  "run_id": "340f2637-78b8-4c2f-9c94-99e70c8f2257",
  "goal": "failure-mode-test",
  "plan": [
    {
      "action_id": "06d784ef-d070-4f31-b3d8-e356827c10c9",
      "type": "fs.list",
      "args": {
        "path": "D:\\Jarvis-proto3\\.tmp",
        "recursive": false
      },
      "risk": "low",
      "requires_approval": false,
      "expected_output": "list output",
      "rollback": null,
      "retries": 1,
      "timeout_ms": 1000,
      "on_failure": "halt"
    }
  ],
  "events": [
    {
      "ts": "2026-03-04T01:16:12.909Z",
      "action_id": "06d784ef-d070-4f31-b3d8-e356827c10c9",
      "status": "planned"
    },
    {
      "ts": "2026-03-04T01:16:12.909Z",
      "action_id": "06d784ef-d070-4f31-b3d8-e356827c10c9",
      "status": "in_progress",
      "attempt": 1
    },
    {
      "ts": "2026-03-04T01:16:12.910Z",
      "action_id": "06d784ef-d070-4f31-b3d8-e356827c10c9",
      "status": "retrying",
      "attempt": 1,
      "stderr": "transient failure",
      "error_code": "TOOL_EXECUTION_FAILED"
    },
    {
      "ts": "2026-03-04T01:16:12.910Z",
      "action_id": "06d784ef-d070-4f31-b3d8-e356827c10c9",
      "status": "in_progress",
      "attempt": 2
    },
    {
      "ts": "2026-03-04T01:16:12.910Z",
      "action_id": "06d784ef-d070-4f31-b3d8-e356827c10c9",
      "status": "ok",
      "attempt": 2,
      "stdout": "recovered",
      "stderr": "",
      "redacted": false
    }
  ],
  "artifacts": [],
  "repair_history": [],
  "final_result": {
    "status": "ok",
    "summary": "Run completed successfully."
  }
}